Cidade,Nome da Praia,Trecho / Ponto de Referência,Período de Amostragem,Status,Classificação dos 100m
MATARACA - PB,BARRA DO GUAJÚ,Em frente à desembocadura do Rio Guajú,19/01/2026 a 21/01/2026,PRÓPRIO,Adequado para banho
MATARACA - PB,PAVUNA,Em frente à Lagoa da Pavuna,19/01/2026 a 21/01/2026,PRÓPRIO,Adequado para banho
MATARACA - PB,BALEIA E BARRA DE CAMARATUBA,No final do acesso à praia da Rua Valfredo Medeiros,19/01/2026 a 21/01/2026,PRÓPRIO,Adequado para banho
MATARACA - PB,BALEIA E BARRA DE CAMARATUBA,Foz do Rio Camaratuba,19/01/2026 a 21/01/2026,PRÓPRIO,Adequado para banho
BAÍA DA TRAIÇÃO - PB,TAMBÁ E PRAIA DO FORTE,Final do acesso à praia na Aldeia Galego,19/01/2026 a 21/01/2026,PRÓPRIO,Adequado para banho
BAÍA DA TRAIÇÃO - PB,TAMBÁ E PRAIA DO FORTE,Final da Rua Dom Pedro II,19/01/2026 a 21/01/2026,PRÓPRIO,Adequado para banho
"BAÍA DA TRAIÇÃO - PB","BAÍA DA TRAIÇÃO, TRINCHEIRAS E ACAJUTIBIRÓ",Final da Rua José Edilson de Medeiros,19/01/2026 a 21/01/2026,PRÓPRIO,Adequado para banho
"BAÍA DA TRAIÇÃO - PB","BAÍA DA TRAIÇÃO, TRINCHEIRAS E ACAJUTIBIRÓ",Final da Rua Siqueira Campos,19/01/2026 a 21/01/2026,PRÓPRIO,Adequado para banho
"BAÍA DA TRAIÇÃO - PB","BAÍA DA TRAIÇÃO, TRINCHEIRAS E ACAJUTIBIRÓ",Final da Rua Projetada Seis,19/01/2026 a 21/01/2026,PRÓPRIO,Adequado para banho
RIO TINTO - PB,BARRA DE MAMANGUAPE E PRAIA DE CAMPINA,Foz do Rio Mamanguape,19/01/2026 a 21/01/2026,PRÓPRIO,Adequado para banho
RIO TINTO - PB,BARRA DE MAMANGUAPE E PRAIA DE CAMPINA,No final da PB 008,19/01/2026 a 21/01/2026,PRÓPRIO,Adequado para banho
RIO TINTO - PB,PRAIA DE OITEIRO,Trechos próximos à foz do Rio Miriri,19/01/2026 a 21/01/2026,PRÓPRIO,Adequado para banho
LUCENA - PB,BONSUCESSO E LUCENA,No final da Rua Mariano de Souza Falcão,19/01/2026 a 21/01/2026,PRÓPRIO,Adequado para banho
LUCENA - PB,BONSUCESSO E LUCENA,Em frente a desembocadura do Riacho Bonsucesso,19/01/2026 a 21/01/2026,PRÓPRIO,Adequado para banho
LUCENA - PB,PONTA DE LUCENA,Na desembocadura da Camboa em Ponta de Lucena,19/01/2026 a 21/01/2026,PRÓPRIO,Adequado para banho
LUCENA - PB,GAMELEIRA E FAGUNDES,Em frente à desembocadura do Riacho do Araçá,19/01/2026 a 21/01/2026,PRÓPRIO,Adequado para banho
LUCENA - PB,GAMELEIRA E FAGUNDES,No final da Travessa São José,19/01/2026 a 21/01/2026,PRÓPRIO,Adequado para banho
LUCENA - PB,COSTINHA,No final da Rua Ubiratan Galvão,19/01/2026 a 21/01/2026,PRÓPRIO,Adequado para banho
"CABEDELO - PB","MIRAMAR, PONTA DE MATO E FORMOSA",No final da Av. Cassiano da Cunha Nóbrega,19/01/2026 a 21/01/2026,PRÓPRIO,Adequado para banho
"CABEDELO - PB","MIRAMAR, PONTA DE MATO E FORMOSA",No final da Rua Nossa senhora dos Navegantes,19/01/2026 a 21/01/2026,PRÓPRIO,Adequado para banho
"CABEDELO - PB","MIRAMAR, PONTA DE MATO E FORMOSA",No final da Rua Monsenhor José Coutinho da silva,19/01/2026 a 21/01/2026,PRÓPRIO,Adequado para banho
CABEDELO - PB,AREIA DOURADA E CAMBOINHA,No final da Rua Projetada,19/01/2026 a 21/01/2026,PRÓPRIO,Adequado para banho
CABEDELO - PB,AREIA DOURADA E CAMBOINHA,No final da Rua Benício de Oliveira,19/01/2026 a 21/01/2026,PRÓPRIO,Adequado para banho
CABEDELO - PB,POÇO E PONTA DE CAMPINA,No final da Rua Santa Cavalcante,19/01/2026 a 21/01/2026,PRÓPRIO,Adequado para banho
CABEDELO - PB,POÇO E PONTA DE CAMPINA,Em frente a galeria de águas pluviais,19/01/2026 a 21/01/2026,PRÓPRIO,Adequado para banho
CABEDELO - PB,INTERMARES,Em frente ao Maceió de Intermares,19/01/2026 a 21/01/2026,PRÓPRIO,Adequado para banho
JOÃO PESSOA - PB,BESSA I E BESSA,Em frente a desembocadura do Maceió do Bessa,19/01/2026 a 21/01/2026,PRÓPRIO,Adequado para banho
JOÃO PESSOA - PB,BESSA I E BESSA,No final da Rua Dr. Abel Beltrão,19/01/2026 a 21/01/2026,PRÓPRIO,Adequado para banho
JOÃO PESSOA - PB,BESSA II,Final da Av. Gov. Flávio Ribeiro Coutinho,19/01/2026 a 21/01/2026,PRÓPRIO,Adequado para banho
JOÃO PESSOA - PB,MANAÍRA E TAMBAÚ,Em frente ao Nº 1461 da Av. João Maurício,19/01/2026 a 21/01/2026,PRÓPRIO,Adequado para banho
JOÃO PESSOA - PB,MANAÍRA E TAMBAÚ,Em frente a quadra de Manaíra,19/01/2026 a 21/01/2026,PRÓPRIO,Adequado para banho
JOÃO PESSOA - PB,MANAÍRA E TAMBAÚ,Em frente ao Nº 315 da Av. João Maurício,19/01/2026 a 21/01/2026,PRÓPRIO,Adequado para banho
JOÃO PESSOA - PB,MANAÍRA E TAMBAÚ,No final da Av. Ruy Carneiro,19/01/2026 a 21/01/2026,PRÓPRIO,Adequado para banho
JOÃO PESSOA - PB,MANAÍRA E TAMBAÚ,Em frente ao busto de Tamandaré,19/01/2026 a 21/01/2026,PRÓPRIO,Adequado para banho
JOÃO PESSOA - PB,CABO BRANCO,No final da Av. Monsenhor Odilon Coutinho,19/01/2026 a 21/01/2026,PRÓPRIO,Adequado para banho
JOÃO PESSOA - PB,CABO BRANCO,No final da Rua Gregorio Pessoa de Oliveira,19/01/2026 a 21/01/2026,PRÓPRIO,Adequado para banho
JOÃO PESSOA - PB,CABO BRANCO,No final da Rua Áurea,19/01/2026 a 21/01/2026,PRÓPRIO,Adequado para banho
JOÃO PESSOA - PB,CABO BRANCO,Em frente a rotatória do Cabo Branco,19/01/2026 a 21/01/2026,PRÓPRIO,Adequado para banho
JOÃO PESSOA - PB,SEIXAS,Em frente a galeria de águas pluviais,19/01/2026 a 21/01/2026,PRÓPRIO,Adequado para banho
JOÃO PESSOA - PB,SEIXAS,No final da Av. das Falésias,19/01/2026 a 21/01/2026,PRÓPRIO,Adequado para banho
JOÃO PESSOA - PB,PENHA,Em frente a desembocadura do Rio Cabelo,19/01/2026 a 21/01/2026,PRÓPRIO,Adequado para banho
JOÃO PESSOA - PB,PENHA,Em frente a desembocadura do Rio Aratu,19/01/2026 a 21/01/2026,PRÓPRIO,Adequado para banho
"JOÃO PESSOA - PB","JACARAPÉ, ARRAIAL E SOL",Ao final da Rua Manoel Cândido Soares,19/01/2026 a 21/01/2026,IMPRÓPRIO,"Evitar o banho no raio de 100 metros à direita e à esquerda deste ponto"
"JOÃO PESSOA - PB","JACARAPÉ, ARRAIAL E SOL",Em frente a desembocadura do Rio Cuiá,19/01/2026 a 21/01/2026,PRÓPRIO,Adequado para banho
"JOÃO PESSOA - PB","JACARAPÉ, ARRAIAL E SOL",Em frente a desembocadura do Riacho Camurupim,19/01/2026 a 21/01/2026,PRÓPRIO,Adequado para banho
JOÃO PESSOA - PB,BARRA DO GRAMAME,Em frente a desembocadura do Rio Gramame,19/01/2026 a 21/01/2026,PRÓPRIO,Adequado para banho
CONDE - PB,AMOR E JACUMÃ,Em frente a desembocadura do Rio Guruqi,19/01/2026 a 21/01/2026,PRÓPRIO,Adequado para banho
CONDE - PB,AMOR E JACUMÃ,Em frente a desembocadura do maceió de Jacumã,19/01/2026 a 21/01/2026,PRÓPRIO,Adequado para banho
CONDE - PB,CARAPIBÚS E TABATINGA,No final da Rua Maria Carmelita Vasconselos,19/01/2026 a 21/01/2026,PRÓPRIO,Adequado para banho
CONDE - PB,CARAPIBÚS E TABATINGA,Em frente a desembocadura do Maceió Bucatu,19/01/2026 a 21/01/2026,PRÓPRIO,Adequado para banho
CONDE - PB,COQUEIRINHO,Enseada de Coqueirinho,19/01/2026 a 21/01/2026,PRÓPRIO,Adequado para banho
CONDE - PB,TAMBABA,Tambaba,19/01/2026 a 21/01/2026,PRÓPRIO,Adequado para banho
CONDE - PB,BARRA DO GRAÚ,Foz do Rio Graú,19/01/2026 a 21/01/2026,PRÓPRIO,Adequado para banho
PITIMBÚ - PB,BELA,Em frente ao Maceió de Praia Bela,19/01/2026 a 21/01/2026,PRÓPRIO,Adequado para banho
PITIMBÚ - PB,BARRA DO ABIAÍ,Foz do Rio Abiaí,19/01/2026 a 21/01/2026,PRÓPRIO,Adequado para banho
"PITIMBÚ - PB","PITIMBÚ, MACEIÓ E GUARITA",No final da Rua da Paz,19/01/2026 a 21/01/2026,PRÓPRIO,Adequado para banho
"PITIMBÚ - PB","PITIMBÚ, MACEIÓ E GUARITA",Em frente a desembocadura do riacho Engenho Velho,19/01/2026 a 21/01/2026,PRÓPRIO,Adequado para banho
"PITIMBÚ - PB","PITIMBÚ, MACEIÓ E GUARITA",Em frente a desembocadura da Lagoa,19/01/2026 a 21/01/2026,PRÓPRIO,Adequado para banho
"PITIMBÚ - PB",AZUL/SANTA RITA E COQUEIROS,Em frente as galerias de águas pluviais,19/01/2026 a 21/01/2026,PRÓPRIO,Adequado para banho
"PITIMBÚ - PB",AZUL/SANTA RITA E COQUEIROS,No final da Rua Almirante Tamandaré,19/01/2026 a 21/01/2026,PRÓPRIO,Adequado para banho
"PITIMBÚ - PB",PONTA DOS COQUEIROS E ACAÚ/PONTINHA,Em frente a desembocadura da Lagoa,19/01/2026 a 21/01/2026,PRÓPRIO,Adequado para banho
"PITIMBÚ - PB",PONTA DOS COQUEIROS E ACAÚ/PONTINHA,Em frente a desembocadura do Rio Goiana,19/01/2026 a 21/01/2026,PRÓPRIO,Adequado para banho